{"admissionEffect":"tiered_photonic_constants_only","authority":"root_owned_informational_sidecar","candidateFingerprint":"a05b0b543c473b3ffb0c282eff0300fc2d392b7d97a5cbf382d20a4a928ae404","candidateId":"CH_TIERED_v1","coordinateId":"photonic.tiered_v1","deferredWork":["D1-D7 extension","satellite/boundary evaluation","photonic-to-harmonic correspondence","true FM Bessel sideband (requires authored beta)"],"globalAggregate":{"guardLiteral":"C_H is a derived harmonic property, not a photonic measurement, not C_P, not C_S, not kappa_court, and not a thermodynamic quantity: not temperature, entropy, enthalpy, or free energy.","namespace":"harmonic.C_H","status":"unresolved","value":null},"interpretationPolicy":{"causationClaim":false,"globalCHNull":true,"note":"Derived constants are authored informational sidecar; numeric bands only canonical; UV labels Layer-4 prose; not C_P replacement, not C_H, not kappa_court, not thermodynamic; not a tier classifier.","physicalQuantityClaim":false,"tierClassifier":false},"invariants":{"anchorCount":14,"channelBlindDerivation":true,"edgeFaithfulProvenance":true,"meanDoubling":{"sumNuA0":0.013632087044548104,"sumNuA1":0.027264174089096208,"sumNuA2":0.054528348178192416},"recordCount":28,"strictBands":{"geom_A1":[433.59,637.18],"geom_A2":[462.79,591.25],"sum_A1":[216.09,317.19],"sum_A2":[114.06,144.78]},"variantsPerAnchor":2},"method":{"a0WavelengthsNm":{"Jupiter":470,"Mars":580,"Mercury":530,"Moon":610,"Saturn":400,"Sun":700,"Venus":430},"a0WavenumbersPerNm":{"Jupiter":0.002127659574468085,"Mars":0.0017241379310344827,"Mercury":0.0018867924528301887,"Moon":0.001639344262295082,"Saturn":0.0025,"Sun":0.0014285714285714286,"Venus":0.002325581395348837},"algorithmVersion":"gov-2xx.tiered-photonic-K-convolution.v1","channelBlindDerivation":true,"constants":{"electronVoltJ":0.0000000000000000001602176634,"planckJS":0.000000000000000000000000000000000662607015,"speedOfLightMS":299792458},"constructionKernel":"K = delta_{-1} + delta_{+1} over Z7 office ring (adjacency of C7)","derivedGeometricLambdas":{"lambda_A1_geom":{"Jupiter":477.3887304912004,"Mars":568.59475903318,"Mercury":522.1110992882645,"Moon":637.1812928829596,"Saturn":548.6346689738081,"Sun":493.9635614091388,"Venus":433.58966777357597},"lambda_A2_geom":{"Jupiter":475.7961518142987,"Mars":576.7836901933338,"Mercury":520.9997410544461,"Moon":529.9670670622852,"Saturn":462.7931465391864,"Sun":591.2526936066723,"Venus":511.77339528825274}},"derivedWavenumbers":{"nu_A1":{"Jupiter":0.0042123738481790254,"Mars":0.0035261367151252707,"Mercury":0.003851797505502568,"Moon":0.003152709359605911,"Saturn":0.0037541528239202655,"Sun":0.004139344262295082,"Venus":0.004627659574468085},"nu_A2":{"Jupiter":0.008479457079970653,"Mars":0.0070045068651084785,"Mercury":0.007738510563304296,"Moon":0.007665480977420353,"Saturn":0.008767003836763168,"Sun":0.006906862183526177,"Venus":0.007966526672099291}},"edgeFaithfulProvenance":true,"officeChaldeanDegrees":{"Jupiter":2,"Mars":3,"Mercury":6,"Moon":7,"Saturn":1,"Sun":4,"Venus":5},"officeOrder":["Sun","Moon","Mars","Mercury","Jupiter","Venus","Saturn"],"spectrumNote":"Over R spectrum of K is 2cos(2πj/7); K^7=2δ0 holds in char 7 as office-ring formal signature (same family as M^7=id), never as R identity","sumDoubling":{"ratioA1":2,"ratioA2":2,"sumNuA0":0.013632087044548104,"sumNuA1":0.027264174089096208,"sumNuA2":0.054528348178192416},"variantA":{"domain":"wavenumber nu_hat = 1/lambda_nm","formula":"nu_t[k] = nu_{t-1}[k-1] + nu_{t-1}[k+1]","gamut":"extended vacuum UV","hullPreserved":false,"id":"sum_mixing","meanDoublingProof":"Σν_t = 2^t Σν_0 because each office parents exactly two children","numericBandA1Nm":[216.09,317.19],"numericBandA2Nm":[114.06,144.78],"octaveSemantics":"frequency doubling 2:1 = musical octave — photonic octaves A0 visible -> A1 UV -> A2 EUV"},"variantB":{"domain":"ln lambda_nm (geometric mean = arithmetic mean in log)","formula":"lambda_t[k] = sqrt(lambda_{t-1}[k-1] * lambda_{t-1}[k+1])","gamut":"hull-preserving within [400,700]","hullPreserved":true,"hullProof":"geometric mean stays in convex hull of A0 lambdas by AM>=GM","id":"geometric_mean","numericBandA1Nm":[433.59,637.18],"numericBandA2Nm":[462.79,591.25]}},"negativeControls":{"inputDriftGuard":"declared source mutation must regenerate a distinct candidate or fail source validation"},"records":[{"bandMetadata":{"beyondVisible":true,"extendedGamutNote":"UV-C 100-280, UV-B 280-315, UV-A 315-400, vacuum UV 10-200 per ISO 21348 — canonical bands numeric only; labels are Layer-4 prose","hullPreserved":false,"numericBandNm":[216.09,317.19],"renderingHint":"luminance/grain/pulse for vacuum UV (invisible, strongly absorbed)"},"channelIndependence":true,"constructionEdgeIds":["constructs:A0:1387:1371:0","constructs:A0:2741:1371:1"],"derivationNote":"K-sum in wavenumber: nu_t[k]=nu_{t-1}[k-1]+nu_{t-1}[k+1] (nu_hat=1/lambda_nm) — sum gives octave doubling Σν_t=2^t Σν0","derivedFrequencyHz":1240944190901639.2,"derivedPhotonEnergyEv":5.132132803997224,"derivedPhotonEnergyJ":0.0000000000000000008222583261149253,"derivedWavelengthNm":241.58415841584159,"derivedWavenumberPerM":4139344.262295082,"derivedWavenumberPerNm":0.004139344262295082,"forte":"7-34","interpretationPolicy":{"causationClaim":false,"globalCHNull":true,"note":"Derived photonic constants are authored informational sidecar; not C_P replacement, not C_H, not kappa_court, not thermodynamic; not a tier classifier.","physicalQuantityClaim":false,"tierClassifier":false},"name":"Superlocrian","office":"Sun","parentStateIds":[1387,2741],"parentWavelengthsNm":[400,610],"photonicCompression":null,"recordFingerprint":"965fcf5e4ed6e5e96889690166a9fea77245ef0dcd3e35555dfaaff39bef6b3d","stateId":1371,"tier":"A1","variant":"sum_mixing"},{"bandMetadata":{"beyondVisible":false,"hullPreserved":true,"numericBandNm":[433.59,637.18],"renderingHint":"visible palette"},"channelIndependence":true,"constructionEdgeIds":["constructs:A0:1387:1371:0","constructs:A0:2741:1371:1"],"derivationNote":"K-mean in ln lambda: lambda_t[k]=sqrt(lambda_{t-1}[k-1]*lambda_{t-1}[k+1]) — arithmetic mean in log-space, hull-preserving","derivedFrequencyHz":606912091136391.9,"derivedPhotonEnergyEv":2.5099867301852847,"derivedPhotonEnergyJ":0.00000000000000000040214420907529256,"derivedWavelengthNm":493.9635614091388,"derivedWavenumberPerM":2024440.8254472897,"derivedWavenumberPerNm":0.00202444082544729,"forte":"7-34","interpretationPolicy":{"causationClaim":false,"globalCHNull":true,"note":"Derived photonic constants are authored informational sidecar; not C_P replacement, not C_H, not kappa_court, not thermodynamic; not a tier classifier.","physicalQuantityClaim":false,"tierClassifier":false},"name":"Superlocrian","office":"Sun","parentStateIds":[1387,2741],"parentWavelengthsNm":[400,610],"photonicCompression":0.5561447704174708,"recordFingerprint":"6a8165b1359a5a49b1a5001835375f9148ea20b8b80360e34d24e3eec6c4d0b7","stateId":1371,"tier":"A1","variant":"geometric_mean"},{"bandMetadata":{"beyondVisible":true,"extendedGamutNote":"UV-C 100-280, UV-B 280-315, UV-A 315-400, vacuum UV 10-200 per ISO 21348 — canonical bands numeric only; labels are Layer-4 prose","hullPreserved":false,"numericBandNm":[216.09,317.19],"renderingHint":"luminance/grain/pulse for vacuum UV (invisible, strongly absorbed)"},"channelIndependence":true,"constructionEdgeIds":["constructs:A0:2773:1749:0","constructs:A0:1717:1749:0"],"derivationNote":"K-sum in wavenumber: nu_t[k]=nu_{t-1}[k-1]+nu_{t-1}[k+1] (nu_hat=1/lambda_nm) — sum gives octave doubling Σν_t=2^t Σν0","derivedFrequencyHz":945158488275862,"derivedPhotonEnergyEv":3.9088614284358703,"derivedPhotonEnergyJ":0.0000000000000000006262686446183814,"derivedWavelengthNm":317.1875,"derivedWavenumberPerM":3152709.359605911,"derivedWavenumberPerNm":0.0031527093596059115,"forte":"7-34","interpretationPolicy":{"causationClaim":false,"globalCHNull":true,"note":"Derived photonic constants are authored informational sidecar; not C_P replacement, not C_H, not kappa_court, not thermodynamic; not a tier classifier.","physicalQuantityClaim":false,"tierClassifier":false},"name":"Acoustic","office":"Moon","parentStateIds":[2773,1717],"parentWavelengthsNm":[700,580],"photonicCompression":null,"recordFingerprint":"f8eccc6eb4edd9a875f291a47e5ab196ffb0ba051b82de6af424f5cd8b3322a0","stateId":1749,"tier":"A1","variant":"sum_mixing"},{"bandMetadata":{"beyondVisible":false,"hullPreserved":true,"numericBandNm":[433.59,637.18],"renderingHint":"visible palette"},"channelIndependence":true,"constructionEdgeIds":["constructs:A0:2773:1749:0","constructs:A0:1717:1749:0"],"derivationNote":"K-mean in ln lambda: lambda_t[k]=sqrt(lambda_{t-1}[k-1]*lambda_{t-1}[k+1]) — arithmetic mean in log-space, hull-preserving","derivedFrequencyHz":470497896514779.25,"derivedPhotonEnergyEv":1.9458229520867973,"derivedPhotonEnergyJ":0.0000000000000000003117552067734368,"derivedWavelengthNm":637.1812928829596,"derivedWavenumberPerM":1569412.0514358613,"derivedWavenumberPerNm":0.0015694120514358613,"forte":"7-34","interpretationPolicy":{"causationClaim":false,"globalCHNull":true,"note":"Derived photonic constants are authored informational sidecar; not C_P replacement, not C_H, not kappa_court, not thermodynamic; not a tier classifier.","physicalQuantityClaim":false,"tierClassifier":false},"name":"Acoustic","office":"Moon","parentStateIds":[2773,1717],"parentWavelengthsNm":[700,580],"photonicCompression":0.13145124800680386,"recordFingerprint":"b44c1ee2ff86f717f371cad8a146ea615e1119124cd4ad8b2e952db865a4e339","stateId":1749,"tier":"A1","variant":"geometric_mean"},{"bandMetadata":{"beyondVisible":true,"extendedGamutNote":"UV-C 100-280, UV-B 280-315, UV-A 315-400, vacuum UV 10-200 per ISO 21348 — canonical bands numeric only; labels are Layer-4 prose","hullPreserved":false,"numericBandNm":[216.09,317.19],"renderingHint":"luminance/grain/pulse for vacuum UV (invisible, strongly absorbed)"},"channelIndependence":true,"constructionEdgeIds":["